{
  "schema_version": 1,
  "id": "system_info",
  "entry": "modules/mod_system_info.sh",
  "category": {
    "id": "system"
  },
  "order": 20,
  "docs": "modules/doc_system_info.md",
  "display": {
    "name_key": "SYSTEM_INFO_MODULE_NAME",
    "description_key": "SYSTEM_INFO_MODULE_DESC",
    "fallback_name": "Display System Information",
    "fallback_description": "Show comprehensive system information and hardware details"
  },
  "i18n": {
    "module_name": "system_info"
  },
  "help": {
    "overview_key": "SYSTEM_INFO_HELP_OVERVIEW",
    "options_key": "SYSTEM_INFO_HELP_OPTIONS",
    "notes_key": "SYSTEM_INFO_HELP_NOTES"
  },
  "expose": {
    "cli": true,
    "gui": true
  },
  "enabled": true,
  "requires_root": false,
  "tags": ["system", "information", "hardware", "diagnostics"]
}
