{
  "schema_version": 1,
  "id": "disk",
  "entry": "modules/mod_disk.sh",
  "category": {
    "id": "system"
  },
  "order": 40,
  "docs": "modules/doc_disk.md",
  "display": {
    "name_key": "DISK_MODULE_NAME",
    "description_key": "DISK_MODULE_DESC",
    "fallback_name": "Disk Tools",
    "fallback_description": "Disk utilities and storage analysis tools"
  },
  "i18n": {
    "module_name": "disk"
  },
  "help": {
    "overview_key": "DISK_HELP_OVERVIEW",
    "options_key": "DISK_HELP_OPTIONS",
    "notes_key": "DISK_HELP_NOTES"
  },
  "expose": {
    "cli": true,
    "gui": true
  },
  "enabled": true,
  "requires_root": false,
  "tags": ["disk", "storage", "analysis", "utilities"]
}
