{
  "schema_version": 1,
  "id": "restarts",
  "entry": "modules/mod_restarts.sh",
  "category": {
    "id": "recovery"
  },
  "order": 10,
  "docs": "modules/doc_restarts.md",
  "display": {
    "name_key": "RESTARTS_MODULE_NAME",
    "description_key": "RESTARTS_MODULE_DESC",
    "fallback_name": "Services & Desktop Restart Options",
    "fallback_description": "Restart system services, desktop environment, and power management"
  },
  "i18n": {
    "module_name": "restarts"
  },
  "help": {
    "overview_key": "RESTARTS_HELP_OVERVIEW",
    "options_key": "RESTARTS_HELP_OPTIONS",
    "notes_key": "RESTARTS_HELP_NOTES"
  },
  "expose": {
    "cli": true,
    "gui": true
  },
  "enabled": true,
  "requires_root": true,
  "tags": ["recovery", "services", "restart", "systemd"]
}
